{
  "id": "naqp",
  "name": "North American QSO Party",
  "short": "NAQP",
  "description": "Exchange: name + state/province/country. 1 point per QSO. Multipliers are states, provinces and North American countries.",
  "sentHint": "Name + our state",
  "exchange": [
    {
      "key": "name",
      "label": "Name",
      "kind": "text",
      "required": true,
      "placeholder": "BOB"
    },
    {
      "key": "loc",
      "label": "State / prov / DX",
      "kind": "region",
      "regions": [
        {
          "code": "AL",
          "name": "Alabama"
        },
        {
          "code": "AK",
          "name": "Alaska"
        },
        {
          "code": "AZ",
          "name": "Arizona"
        },
        {
          "code": "AR",
          "name": "Arkansas"
        },
        {
          "code": "CA",
          "name": "California"
        },
        {
          "code": "CO",
          "name": "Colorado"
        },
        {
          "code": "CT",
          "name": "Connecticut"
        },
        {
          "code": "DE",
          "name": "Delaware"
        },
        {
          "code": "DC",
          "name": "District of Columbia"
        },
        {
          "code": "FL",
          "name": "Florida"
        },
        {
          "code": "GA",
          "name": "Georgia"
        },
        {
          "code": "HI",
          "name": "Hawaii"
        },
        {
          "code": "ID",
          "name": "Idaho"
        },
        {
          "code": "IL",
          "name": "Illinois"
        },
        {
          "code": "IN",
          "name": "Indiana"
        },
        {
          "code": "IA",
          "name": "Iowa"
        },
        {
          "code": "KS",
          "name": "Kansas"
        },
        {
          "code": "KY",
          "name": "Kentucky"
        },
        {
          "code": "LA",
          "name": "Louisiana"
        },
        {
          "code": "ME",
          "name": "Maine"
        },
        {
          "code": "MD",
          "name": "Maryland"
        },
        {
          "code": "MA",
          "name": "Massachusetts"
        },
        {
          "code": "MI",
          "name": "Michigan"
        },
        {
          "code": "MN",
          "name": "Minnesota"
        },
        {
          "code": "MS",
          "name": "Mississippi"
        },
        {
          "code": "MO",
          "name": "Missouri"
        },
        {
          "code": "MT",
          "name": "Montana"
        },
        {
          "code": "NE",
          "name": "Nebraska"
        },
        {
          "code": "NV",
          "name": "Nevada"
        },
        {
          "code": "NH",
          "name": "New Hampshire"
        },
        {
          "code": "NJ",
          "name": "New Jersey"
        },
        {
          "code": "NM",
          "name": "New Mexico"
        },
        {
          "code": "NY",
          "name": "New York"
        },
        {
          "code": "NC",
          "name": "North Carolina"
        },
        {
          "code": "ND",
          "name": "North Dakota"
        },
        {
          "code": "OH",
          "name": "Ohio"
        },
        {
          "code": "OK",
          "name": "Oklahoma"
        },
        {
          "code": "OR",
          "name": "Oregon"
        },
        {
          "code": "PA",
          "name": "Pennsylvania"
        },
        {
          "code": "RI",
          "name": "Rhode Island"
        },
        {
          "code": "SC",
          "name": "South Carolina"
        },
        {
          "code": "SD",
          "name": "South Dakota"
        },
        {
          "code": "TN",
          "name": "Tennessee"
        },
        {
          "code": "TX",
          "name": "Texas"
        },
        {
          "code": "UT",
          "name": "Utah"
        },
        {
          "code": "VT",
          "name": "Vermont"
        },
        {
          "code": "VA",
          "name": "Virginia"
        },
        {
          "code": "WA",
          "name": "Washington"
        },
        {
          "code": "WV",
          "name": "West Virginia"
        },
        {
          "code": "WI",
          "name": "Wisconsin"
        },
        {
          "code": "WY",
          "name": "Wyoming"
        },
        {
          "code": "AB",
          "name": "Alberta"
        },
        {
          "code": "BC",
          "name": "British Columbia"
        },
        {
          "code": "MB",
          "name": "Manitoba"
        },
        {
          "code": "NB",
          "name": "New Brunswick"
        },
        {
          "code": "NL",
          "name": "Newfoundland and Labrador"
        },
        {
          "code": "NS",
          "name": "Nova Scotia"
        },
        {
          "code": "NT",
          "name": "Northwest Territories"
        },
        {
          "code": "NU",
          "name": "Nunavut"
        },
        {
          "code": "ON",
          "name": "Ontario"
        },
        {
          "code": "PE",
          "name": "Prince Edward Island"
        },
        {
          "code": "QC",
          "name": "Quebec"
        },
        {
          "code": "SK",
          "name": "Saskatchewan"
        },
        {
          "code": "YT",
          "name": "Yukon"
        }
      ],
      "required": true,
      "placeholder": "MA · ON · DX"
    }
  ],
  "multiplier": {
    "kind": "location",
    "field": "loc",
    "naOnly": true,
    "dxCounts": true
  },
  "multLabel": "States / provinces / NA countries",
  "regionSet": "us_ca",
  "points": {
    "kind": "fixed",
    "points": 1
  },
  "dupe": "per_band",
  "defaultFields": [
    "band",
    "mode",
    "frequency",
    "time",
    "notes"
  ]
}
